{
  "@context": "https://linked.art/ns/v1/linked-art.json",
  "id": "https://linked.art/example/object/nightwatch/47",
  "type": "HumanMadeObject",
  "_label": "Night Watch by Rembrandt",
  "dimension": [
    {
      "type": "Dimension",
      "_label": "brown",
      "classified_as": [
        {
          "id": "http://vocab.getty.edu/aat/300080438",
          "type": "Type",
          "_label": "Color"
        }
      ],
      "value": 11754015.0,
      "unit": {
        "id": "http://vocab.getty.edu/aat/300266239",
        "type": "MeasurementUnit",
        "_label": "rgb"
      }
    }
  ]
}