{
  "@context": "https://linked.art/ns/v1/linked-art.json",
  "id": "https://linked.art/example/object/nightwatch/14",
  "type": "HumanMadeObject",
  "_label": "Painting",
  "classified_as": [
    {
      "id": "http://vocab.getty.edu/aat/300033618",
      "type": "Type",
      "_label": "Painting",
      "classified_as": [
        {
          "id": "http://vocab.getty.edu/aat/300435443",
          "type": "Type",
          "_label": "Type of Work"
        }
      ]
    },
    {
      "id": "http://vocab.getty.edu/aat/300133025",
      "type": "Type",
      "_label": "Artwork"
    }
  ],
  "current_owner": [
    {
      "id": "https://linked.art/example/group/amsterdam_govt",
      "type": "Group",
      "_label": "City of Amsterdam Governing Body"
    }
  ],
  "current_custodian": [
    {
      "id": "http://vocab.getty.edu/ulan/500246547",
      "type": "Group",
      "_label": "Rijksmuseum"
    }
  ]
}