{
  "@context": "https://linked.art/ns/v1/linked-art.json",
  "id": "https://linked.art/example/object/nightwatch/57",
  "type": "HumanMadeObject",
  "_label": "The Night Watch",
  "classified_as": [
    {
      "id": "http://vocab.getty.edu/aat/300033618",
      "type": "Type",
      "_label": "Painting",
      "classified_as": [
        {
          "id": "http://vocab.getty.edu/aat/300435443",
          "type": "Type",
          "_label": "Type of Work"
        }
      ]
    }
  ],
  "identified_by": [
    {
      "type": "Name",
      "classified_as": [
        {
          "id": "http://vocab.getty.edu/aat/300404670",
          "type": "Type",
          "_label": "Primary Name"
        }
      ],
      "content": "The Night Watch"
    }
  ],
  "attributed_by": [
    {
      "type": "AttributeAssignment",
      "identified_by": [
        {
          "type": "Name",
          "classified_as": [
            {
              "id": "http://vocab.getty.edu/aat/300404669",
              "type": "Type",
              "_label": "Display Title"
            }
          ],
          "content": "Related Object"
        }
      ],
      "assigned": [
        {
          "id": "https://linked.art/example/object/rppob-28-106",
          "type": "HumanMadeObject",
          "_label": "Nachtwacht"
        }
      ]
    }
  ]
}