{
  "@context": "https://linked.art/ns/v1/linked-art.json",
  "id": "https://linked.art/example/object/nightwatch/6",
  "type": "HumanMadeObject",
  "_label": "Night Watch by Rembrandt",
  "classified_as": [
    {
      "id": "http://vocab.getty.edu/aat/300033618",
      "type": "Type",
      "_label": "Painting",
      "classified_as": [
        {
          "id": "http://vocab.getty.edu/aat/300435443",
          "type": "Type",
          "_label": "Type of Work"
        }
      ]
    }
  ],
  "dimension": [
    {
      "type": "Dimension",
      "classified_as": [
        {
          "id": "http://vocab.getty.edu/aat/300055647",
          "type": "Type",
          "_label": "Width"
        }
      ],
      "value": 453.5,
      "unit": {
        "id": "http://vocab.getty.edu/aat/300379098",
        "type": "MeasurementUnit",
        "_label": "centimeters"
      }
    },
    {
      "type": "Dimension",
      "classified_as": [
        {
          "id": "http://vocab.getty.edu/aat/300055644",
          "type": "Type",
          "_label": "Height"
        }
      ],
      "value": 379.5,
      "unit": {
        "id": "http://vocab.getty.edu/aat/300379098",
        "type": "MeasurementUnit",
        "_label": "centimeters"
      }
    }
  ]
}