{
  "@context": "https://linked.art/ns/v1/linked-art.json",
  "id": "https://linked.art/example/object/14",
  "type": "HumanMadeObject",
  "_label": "Painting: Pasture and Sheep",
  "identified_by": [
    {
      "type": "Identifier",
      "classified_as": [
        {
          "id": "http://vocab.getty.edu/aat/300312355",
          "type": "Type",
          "_label": "Accession Number"
        }
      ],
      "content": "P1998-27"
    },
    {
      "type": "Name",
      "classified_as": [
        {
          "id": "http://vocab.getty.edu/aat/300404670",
          "type": "Type",
          "_label": "Primary Name"
        }
      ],
      "content": "Pasture and Sheep"
    }
  ]
}